Creating Interactive Presentations with Shiny and R,"Analyzing big data is great, but not if you can't share your results. In this course, Martin Hadley shows how to create interactive presentations of large data sets with R, RStudio, and Shiny, an R-based tool for producing interactive, web-ready data visualizations. Learn why these tools are important to data scientists, how to configure and install them, and how to use them to make your findings more clear and engaging.<br><br> 

Discover the different types of presentations you can make right out of the box with R Markdown templates (built right into RStudio) and how to customize the templates with CSS. Find out how to register for RPubs to deploy RStudio presentations for sharing, and then go beyond the basics with Shiny—adding interactivity and creating embeddable dashboards without the need for HTML or JavaScript.<br><br> 

This is an exciting course for analysts who want to increase the relevance and visibility of their work. Make sure to watch the knowledge checks at the end of each chapter to test your new skills.",Course,2018-09-23 15:19 UTC,N/A,false,N/A,
CONTENT METADATA NO LONGER EXISTS - urn:li:lyndaCourse:163607,CONTENT METADATA NO LONGER EXISTS - urn:li:lyndaCourse:163607,Course,2018-09-17 08:10 UTC,N/A,false,N/A,
"Advanced SAS Programming for R Users, Part 1","SAS is one of the most used data analytics platforms in the world. Enhance your programming skillset by learning how to apply your understanding of R— the language of big data—in the SAS environment at an advanced level. Instructor Jordan Bakerman covers several different advanced techniques for analyzing data via inferential procedures. Learn about linear regression with PROC REG, estimating linear combinations with the general linear model procedure, mixed models and the MIXED procedure, and more.<br><br>

Note: You can visit the <a href=""https://www.sas.com/en_us/software/university-edition.html""_blank"">SAS site</a> to obtain a copy of the software, and use the company's online data sets to do the course exercises.",Course,2019-06-23 06:01 UTC,N/A,false,N/A,
Body Language for Leaders (2015),"Research shows that when your verbal and nonverbal signals are out of alignment, people are forced to choose between what they hear and what they see. And subconsciously, they'll believe your body language. In this course, workplace body-language expert Carol Kinsey Goman, PhD, reveals how body language is perceived and often misread, and shares the six nonverbal signals you need to know to make a positive first impression. She also discusses the importance of body language for leaders, and shows how you can establish leadership presence. Lastly, she provides simple and effective tips on communicating with gestures and stance.",Course,2019-04-26 04:22 UTC,N/A,false,N/A,
Python Parallel Programming Solutions,"Learn parallel programming techniques using Python and explore the many ways you can write code that allows more than one task to occur at a time. First, discover how to develop and implement efficient software architecture that is set up to take advantage of thread-based and process-based parallelism. Next, find out how to use Python modules for asynchronous programming. Then, explore GPU programming using PyCUDA, NumbaPro, and PyOpenCL. This course provides extensive coverage of synchronizing processes, streamlining communication, reducing operations, and optimizing code so you can select and implement the right parallel processing solutions for your applications.<br><br>Note: This course was created by Packt Publishing. We are pleased to host this training in our library.",Course,2019-08-10 11:32 UTC,N/A,false,N/A,
Raspberry Pi: GPIO (2016),"The Raspberry Pi talks to the outside world through the general-purpose input/output device, also known as the GPIO. This course describes these pins and explains how to use the GPIO to control lights and motors, read data from sensors, and interact with the Internet of Things. It combines some hardware basics—identifying pins and working with breadboards and components—with some programming in Python and Scratch. Author Mark Niemann-Ross also shows how to go deep into WiringPi, a GPIO access library, to experiment with pulse width modulation. By learning how to control input and output through GPIO pins, you'll open up a whole new world of electronics.",Course,2019-06-30 04:49 UTC,N/A,false,N/A,
Learning Python GUI Programming,"Learn how to create effective graphical user interfaces (GUIs) with minimal code using Python. Burkhard Meier starts by showing how to create a GUI form, add widgets, manage the resulting layout, and customize the look and feel of the interface. Then, he takes you through working with data, classes, and making charts using the 2D Python plotting library, Matplotbil. Next, he discusses how threading and networking impact the performance of your code. Later in the course, he advances on to working with databases, testing application GUIs, extending a GUI using the wxPython library, and creating 3D GUIs by using PyOpenGL and Pyglet. As you follow along with Burkhard throughout this course, you will develop an entire application's GUI.<br><br>Note: This course was created by Packt Publishing. We are pleased to host this training in our library.",Course,2019-03-05 15:41 UTC,N/A,false,N/A,
Excel Data Visualization: Mastering 20+ Charts and Graphs,"When you think data visualization, you might not think Microsoft Excel. But Excel offers a large number of charts and graphing tools that complement its data analysis toolset. This course offers a laser-focused, practical guide to over 20 useful Excel charts and graphs for data visualization. Instructor Chris Dutton reviews the key principles of data visualization, and provides some introductory tips to help you customize any kind of chart in Excel. In this section, you can learn how to adjust text and cell formatting, change the chart type and axes, and leverage built-in templates. In chapter three, Chris reviews the different chart types: from basic bar and pie charts, to scatter plots, histograms, funnel charts, and sparklines. Plus, learn how to create geospatial heat maps and 3D power maps, and combine different chart types on one sheet.",Course,2019-07-21 04:22 UTC,N/A,false,N/A,
SQL for Statistics Essential Training,"Descriptive statistics help us understand the overall structure of data, and SQL is the most widely used language for manipulating it. Together, they can help data analysts derive better insights and make far-reaching predictions. This course provides an overview of basic descriptive statistics and the SQL commands you need to know to summarize data sets, find averages, and calculate variance and standard deviation. Instructor Dan Sullivan also introduces more detailed analysis techniques using discreet and continuous percentiles to help segment data, and correlations between variables to identify relationships. He concludes with an introduction to linear regression, a widely used predictive analytics technique.",Course,2018-10-14 12:44 UTC,N/A,false,N/A,
R Programming in Data Science: High Velocity Data,"High-velocity data—such as the information that springs from Twitter and IoT devices—comes barreling in at a speed beyond normal comprehension, demanding high-performance from both hardware and software. While it might not initially appear up to the challenge, the R programming language can be revved up to operate with high-velocity data. Written close to the metal by sitting directly on top of the C programming language, R provides a rich set of data structures and concepts. This course drills down into efficient R programming, providing practical strategies that can help you work your mojo on high-velocity data.</br></br>

Instructor Mark Niemann-Ross begins by sharing a framework for understanding the different types of high-velocity data. He then covers how to use R to acquire high-velocity data, as well as how to leverage profiling tools and optimize R code for use with high-velocity data. He wraps up by exploring how to use R to present data, including how to use Shiny—an R package that allows you to build web apps straight from R—for interactive dashboards.",Course,2018-11-16 08:58 UTC,N/A,false,N/A,
Building and Deploying Deep Learning Applications with TensorFlow,"TensorFlow is one of the most popular deep learning frameworks available. It's used for everything from cutting-edge machine learning research to building new features for the hottest start-ups in Silicon Valley. In this course, learn how to install TensorFlow and use it to build a simple deep learning model. After he shows how to get TensorFlow up and running, instructor Adam Geitgey demonstrates how to create and train a machine learning model, as well as how to leverage visualization tools to analyze and improve your model. Finally, he explains how to deploy models locally or in the cloud. When you wrap up this course, you'll be ready to start building and deploying your own models with TensorFlow.",Course,2018-12-08 13:41 UTC,N/A,false,N/A,
Applied Machine Learning: Algorithms,"In the first installment of the <i>Applied Machine Learning</i> series, instructor Derek Jedamski covered foundational concepts, providing you with a general recipe to follow to attack any machine learning problem in a pragmatic, thorough manner. In this course—the second and final installment in the series—Derek builds on top of that architecture by exploring a variety of algorithms, from logistic regression to gradient boosting, and showing how to set a structure that guides you through picking the best one for the problem at hand. Each algorithm has its pros and cons, making each one the preferred choice for certain types of problems. Understanding what actually drives each algorithm, as well as their benefits and drawbacks, can give you a significant competitive advantage as a data scientist.",Course,2019-10-28 05:53 UTC,N/A,false,N/A,
R Programming in Data Science: High Volume Data,"Data fills all available space, and now that storage is cheap, the amount of data has exploded. However, all that information is useless without analysis and context. The R programming language is designed to make it easier to analyze and visualize massive amounts of data. For example, R provides the ability to multiply one block of variables by another—an assumption that provides inherent advantages over other languages. This course shows why R is ideal for high volumes of data, introduces more efficient ways to use the language, and explains how to avoid the problems and capitalize on the opportunities of big data. Learn how to determine if you have enough memory and processing power, produce visualizations of big data, optimize your R code, and use advanced techniques such as parallel processing to speed up your computations. Plus, discover how to integrate R with big-data solutions such as SQL databases and Apache Spark.",Course,2019-10-04 16:28 UTC,N/A,false,N/A,
Excel in the Real World,"Excel is more than just a number cruncher. It's a Swiss Army knife that helps you work with data from anywhere—numbers, dates, times, text, and more. In this short course, Microsoft MVP Oz du Soleil shows how Excel can help solve real-world problems featuring any kind of information. Learn how Excel can be used in interesting, out-of-the-box ways: to manage property, calculate prices for a new product, simplify music arrangements, keep your kids on top of their chores, or even build seating charts for an event. There's nothing Excel can't do. So make it do more for you.",Course,2019-01-17 10:36 UTC,N/A,false,N/A,
Python Data Analysis,"Data science is transforming the way that government and industry leaders look at both specific problems and the world at large. Curious about how data analysis actually works in practice? In this course, instructor Michele Vallisneri shows you how, explaining what it takes to get started with data science using Python.<br/><br/>Michele demonstrates how to set up your analysis environment and provides a refresher on the basics of working with data structures in Python. Then, he jumps into the big stuff: the power of arrays, indexing, and tables in NumPy and pandas—two popular third-party packages designed specifically for data analysis. He also walks through two sample big-data projects: using NumPy to identify and visualize weather patterns and using pandas to analyze the popularity of baby names over the last century. Challenges issued along the way help you practice what you've learned.<br/><br/>Note: This version of the course was updated to reflect recent changes in Python 3, NumPy, and pandas.",Course,2020-12-04 16:16 UTC,N/A,false,N/A,
Learning SSH,"Secure Shell (SSH) offers a safe way to communicate with a server and to connect to systems remotely. Consequently, SSH is a vital skill for anyone who works in IT. In this short course, Scott Simpson explains what SSH is and shows how to connect to an SSH server from different operating systems. He also demonstrates how to transfer files via SSH File Transfer Protocol (SFTP) and secure copy (SCP), and how to set up your own SSH server on Linux and Mac OS X.",Course,2019-04-18 03:53 UTC,N/A,false,N/A,
Preparing for Successful Communication,"For even the most seasoned professionals, mastering the finer points of communication can be a challenge. How do you establish your credentials without bragging? How can you organize complex ideas so they're easy to follow and remember? How can you think on your feet and respond to unfair or unkind remarks? The good news is, crystal clear, concise communication is a skill anyone can learn. In this course, Sam Horn—CEO of the Intrigue Agency—shares innovative strategies for communicating with confidence, whether you're presenting at a conference, speaking up at a meeting, seeking funding, or making a request of a boss, board, client, or colleague. Learn immediately useful tips that can help you personalize content, craft business stories that are interesting and actionable, connect with audiences of five or five hundred, and exude a powerful executive presence that commands attention and respect whenever you speak.",Course,2019-10-26 03:30 UTC,N/A,false,N/A,
SQL Essential Training (2018),"Whatever database application you create—whether it's for bookkeeping, sales, inventory, or even the lowly to-do list—it's all about the data. Completely updated for 2018, <i>SQL Essential Training</i> is designed to help users understand the most common language for database wrangling, SQL. Instructor Bill Weinman teaches all the major features of SQL: creating tables; defining relationships; manipulating strings, numbers, and dates; using triggers to automate actions; and using subselects and views. He offers a solid working knowledge of the language and shows how to retrieve and manage data efficiently. The final chapter includes a real-world example of building a simple and complete database application using SQL.",Course,2018-11-14 03:15 UTC,N/A,false,N/A,
R Essential Training Part 2: Modeling Data,"Trying to locate meaning and direction in big data is difficult. R can help you find your way. R is a statistical programming language to analyze and visualize the relationships between large amounts of data. It's one of the most important tools available for data analysis, machine learning, and data science. This training series provides a thorough introduction to R, with detailed instruction for working with R and RStudio and hands-on examples, from exploratory graphics to neural networks. In part two, <i>Modeling Data</i>, instructor Barton Poulson shows how to compute statistics, analyze data, predict outcomes, and group and classify cases. These are the fundamental techniques you need to generate meaningful insights for your organization.",Course,2020-12-30 19:22 UTC,N/A,false,N/A,
Data Science Foundations: Data Engineering,"Approach big data with confidence by mastering the core skills needed to put data to work for your business. This course covers the basics of data engineering, system design, analytics, and business intelligence. Data science expert Ben Sullins explains how to collect and organize your data so you can deliver results that your organization can leverage. Ben starts by examining the modern data ecosystem and how it relates to running a smart and efficient data hub. Then, he shows you how to perform the principle tasks involved in managing, loading, extracting, and transforming data. He also takes you through staging, profiling, cleansing, and migrating data. Along the way, he provides actionable recommendations that applicable to data experts throughout an organization—analysts, engineers, scientists, modelers, and more.",Course,2018-11-17 14:29 UTC,N/A,false,N/A,
Migrating from React to Angular,"Learn how to convert a React application into an Angular app. Drake Boley starts with preparation steps: installing the Angular CLI, evaluating the structure of an app's code, and using generators. Next comes the conversion process, including how to handle types, interfaces, components, styles, and controllers. Then, directives and pipes transform templates. Finally, services and routing are explored as alternatives to flux architecture.",Course,2019-08-11 05:40 UTC,N/A,false,N/A,
Python: Design Patterns,"Design patterns encourage programming efficiency and code reuse. This course is a look at traditional design patterns as applied to Python. Jungwoo Ryoo covers 15 essential creational, structural, and behavioral patterns to help you solve common coding challenges, while introducing best practices that will keep your solutions consistent, complete, and correct.",Course,2018-09-30 15:09 UTC,N/A,false,N/A,
Android App Development: Design Patterns for Mobile Architecture,"Developers need to know how to manage an app's complexity. In this course, learn how to simplify your apps by applying simple architectural design patterns to your mobile code base. Discover how these design patterns can help you reduce bugs and maximize your development time by making your code easier to read and test. Jon Bott covers different architectural models such as MVC, MVP, and VIPER. In addition, he walks through the conversion process from MVC to a layered architecture, covering dependency injection, the coordinator pattern, and data binding.",Course,2019-08-16 12:16 UTC,N/A,false,N/A,
Excel for Accountants,"Become a better accountant, bookkeeper, or financial analyst with Microsoft Excel. Excel can be used for profit-and-loss (P&L) reporting, forecasting sales, business valuation, quickly analyzing data from programs like QuickBooks, and more. This course shows you how to perform key accounting tasks in Excel, including small business and corporate record-keeping, and importing and exporting data from QuickBooks to Excel. Professor Michael McDonald shows how to record transactions in a general ledger, categorize expenses for taxes, track business performance, use key financial statements, and do a business valuation. The course is for working professionals and business students alike, with short, focused lessons to give you maximum learning in the minimum amount of time.",Course,2019-07-09 03:55 UTC,N/A,false,N/A,
SQL for Exploratory Data Analysis Essential Training,"Learn how to use SQL to understand the characteristics of data sets destined for data science and machine learning. The course begins with an introduction to exploratory data analysis and how it differs from hypothesis-driven statistical analysis. Instructor Dan Sullivan explains how SQL queries and statistical calculations, and visualization tools like Excel and R, can help you verify data quality and avoid incorrect assumptions. Next, find out how to perform data-quality checks, reveal and recover missing values, and check business logic. Discover how to use box plots to understand non-normal distribution of data and use histograms to understand the frequency of data values in particular attributes. Dan also explains how to use the chi square test to understand dependencies and measure correlations between attributes. The course concludes with a collection of tips and best practices for exploratory data analysis.",Course,2020-02-15 04:58 UTC,N/A,false,N/A,
Common Meeting Problems,"Are your meetings ineffective? Are you finding that you run out of time without completing the agenda? Do attendees seem dissatisfied or bored? Trainer Chris Croft outlines the top 10 meeting problems and explains how to manage each one. He covers meetings that aren't necessary; noises and other distractions that throw meetings off track; attendees showing up late; disruptive behavior; lack of focus; meetings that take too long; lack of progress; and lack of participation. Plus, get tips for eliminating some of the most common technology issues that occur during virtual meetings.",Course,2019-10-30 15:03 UTC,N/A,false,N/A,
The Step-by-Step Guide to Building your Thought Leadership on LinkedIn,"Generating business, reaching new clients, or acting as a spokesperson for your company or product—there are many benefits to building your thought leadership on LinkedIn. Whether you are a seasoned professional or just starting out, Alexandra Galviz (""Authentic Alex”) can help. Alex is a Linked Top Voice for the UK and the cofounder of #LinkedInLocal. In this course, she offers a step-by-step guide to using LinkedIn to reach audiences and establish your expertise. She explains how to craft an authentic voice, grow your audience of brand ambassadors, and create courageous content. Each chapter is filled with examples of her favorite thought leaders in the UK, from entrepreneurs to business leaders. By the end, you’ll be sharing your stories in an authentic and relatable way and creating a deeper connection with your network.",Course,2020-10-06 05:52 UTC,N/A,false,N/A,
Learning Hadoop (2015),"Hadoop is indispensible when it comes to processing big data—as necessary to understanding your information as servers are to storing it. This course is your introduction to Hadoop, its file system (HDFS), its processing engine (MapReduce), and its many libraries and programming tools. Developer and big-data consultant Lynn Langit shows how to set up a Hadoop development environment, run and optimize MapReduce jobs, code basic queries with Hive and Pig, and build workflows to schedule jobs. Plus, get a sneak peek at some up-and-coming libraries like Impala and the lightning-fast Spark.",Course,2018-09-23 15:21 UTC,N/A,true,N/A,
Human Resources Foundations,"Whatever business you're in, there's a fundamental need to support the people that work there. That's where human resources comes in. In this course, HR expert Wayne Cascio provides a comprehensive guide to the field of human resources. Wayne ensures new HR professionals are well versed in their core responsibilities: from attracting, interviewing, and hiring candidates to establishing a pay strategy and creating systems for internal training and development. Wayne also discusses the role that HR plays in career development, performance management, and managing an international workforce.",Course,2020-02-15 05:00 UTC,N/A,false,N/A,
Data Visualization: A Lesson and Listen Series,"Follow along with expert Bill Shander in this series exploring key themes in data visualization, data storytelling, and information design. Each episode is broken into two segments: a short lesson and a listening session where Bill interviews data storytelling and visualization experts about the episode theme. These conversations reveal the creative process, explore techniques and technologies used by working professionals, and illuminate some of the common challenges they face. This series is perfect for anyone interested in how information is presented to the mass market, including professionals in all levels of analytics, data science, and communications.</br></br>Note: Because this is an ongoing series, viewers will not receive a certificate of completion.",Course,2018-10-23 16:22 UTC,N/A,false,N/A,
Java for Data Scientists Essential Training,"Learn how to use Java for two components of data science—data engineering and data analysis. Instead of poring over every facet of Java, instructor Charles Kelly focuses on a selection of valuable topics that will help you learn how to leverage Java in your data science career. This course revolves around the ingest, model, query, analyze, and visualize (IMQAV) model, which is a framework for data science workflows. Charles goes over test-driven development and object-oriented design. Using the free community edition of IntelliJ from JetBrains, he presents Java examples including Java classes, methods, operations, and libraries. Plus, Charles shares how to apply the skills that you learned in the course to create magic squares and sudoku puzzles.",Course,2019-01-17 10:31 UTC,N/A,false,N/A,
Learning R (2013),"Join author Barton Poulson as he introduces the R statistical processing language, including how to install R on your computer, read data from SPSS and spreadsheets, and use packages for advanced R functions.<br><br>

The course continues with examples on how to create charts and plots, check statistical assumptions and the reliability of your data, look for data outliers, and use other data analysis tools. Finally, learn how to get charts and tables out of R and share your results with presentations and web pages.",Course,2018-10-03 03:18 UTC,N/A,false,N/A,
